{"duals_note":"Shadow prices and demand prices are row duals of the LP with the binaries fixed at the MILP optimum: they are conditional on that open set and valid only for small right-hand-side changes. Absent for relaxed scenarios.","flow_precision":"tons rounded to 3 decimals; flows below 0.0005 t omitted","generated_at":"2026-10-11T04:03:21Z","scenarios":[{"binding":[{"group":"capacity","id":"S10","shadow_usd_per_unit":22.825,"slack":0.0,"unit":"throughput unit"},{"group":"plant_supply","id":"P0/cold","shadow_usd_per_unit":8.32,"slack":0.0,"unit":"ton"},{"group":"plant_supply","id":"P0/ambient","shadow_usd_per_unit":4.992,"slack":0.0,"unit":"ton"},{"group":"plant_supply","id":"P0/bulk","shadow_usd_per_unit":3.744,"slack":0.0,"unit":"ton"}],"components":{"fixed_usd":194720000.0,"handling_usd":33722082.99999998,"inbound_transport_usd":166388551.32000098,"outbound_transport_usd":168791177.30500567,"penalties_usd":{"capacity_overshoot":0.0,"open_sites_excess":0.0,"supply_overshoot":0.0,"unmet_demand":0.0}},"demand_price_usd_ton":[[36.41,67.68,34.56],[147.48,252.8,117.86],[352.7,607.08,262.59],[48.14,87.24,43.36],[300.43,515.0,227.11],[68.92,123.42,57.78],[127.8,223.8,100.26],[194.03,332.6,151.11],[143.19,247.92,112.94],[141.58,245.16,111.79],[149.06,255.44,119.05],[109.39,192.24,87.11],[271.87,466.04,206.71],[291.93,500.36,221.1],[237.41,412.26,178.13],[296.42,514.72,219.3],[9.0,22.0,14.0],[382.53,656.24,285.37],[220.97,383.52,166.81],[283.83,487.04,214.87],[246.0,421.7,188.24],[116.35,204.72,91.66],[241.54,419.34,181.08],[69.72,126.1,57.38],[242.56,418.26,183.92],[107.77,190.02,85.53],[370.73,637.98,275.47],[274.69,471.38,210.72],[234.1,401.3,179.74],[338.58,580.4,254.36],[272.34,473.44,202.1],[269.46,461.84,205.05],[302.69,519.62,228.18],[310.05,531.5,233.99],[212.81,370.08,160.56],[367.09,629.78,274.35],[286.54,491.12,217.25],[314.49,539.84,236.6],[158.63,277.2,121.86],[156.54,268.34,124.34],[288.5,494.54,218.18],[354.66,610.44,263.99],[188.99,323.96,147.51],[232.63,403.5,175.13],[220.81,378.44,170.3],[384.1,658.94,286.5],[144.38,249.96,113.79],[282.29,488.64,210.61],[207.35,360.72,156.66],[185.55,322.8,141.51],[246.5,422.54,188.58],[163.89,280.94,129.59],[203.84,349.34,158.17],[263.46,452.36,200.15],[280.94,481.58,213.19],[41.87,77.04,38.46],[172.08,294.98,135.44],[165.78,284.18,130.94],[122.55,214.8,96.51],[162.6,278.72,128.66],[275.6,477.72,205.41],[224.71,390.48,169.06],[169.65,296.1,129.73],[355.43,611.76,264.54],[213.05,370.5,160.73],[39.52,73.02,36.78],[330.06,566.54,247.72],[250.2,428.9,191.24],[136.05,235.68,107.84],[309.81,531.08,233.81],[349.41,601.44,260.24],[249.0,433.42,185.43],[307.32,526.82,232.04],[255.3,440.1,193.02],[200.15,343.1,155.49],[282.39,489.36,210.26],[160.97,281.22,123.53],[181.87,314.22,140.57],[170.89,297.66,131.03],[243.46,417.26,186.47],[227.78,390.38,175.27],[248.96,432.06,186.38],[298.19,511.16,225.51],[231.74,402.54,174.08],[140.39,243.12,110.94],[163.77,286.02,125.53],[140.74,243.72,111.19],[305.61,523.88,230.81],[179.34,314.02,135.68],[157.23,274.8,120.86],[132.66,229.86,105.42],[256.55,439.7,195.82],[132.41,229.44,105.24],[304.87,527.34,226.73],[156.81,274.08,120.56],[283.25,485.48,214.9],[105.14,186.82,82.67],[19.85,40.6,21.75],[159.2,272.9,126.23],[278.17,476.84,211.21]],"description":"Minimum-cost open set and flows for the baseline synthetic network.","id":"optimized","kind":"design","label":"Optimized network","lp_relaxation_bound_usd":562042407.28,"lp_text_sha256":"16d01ddf385ec8a4d920ef90d02a246fe38d89ad8e62bf61aaa9086e40b1ac1e","mip_gap":0.0,"mip_nodes":1,"objective_usd":563621811.62,"open_sites":[0,1,2,3,4,5,8,10],"params":{"capacity_scale":1.0,"closed_lanes":[],"closed_sites":[],"demand_scale":1.0,"fixed_cost_scale":1.0,"fixed_open":null,"freight_scale":1.0,"max_open_sites":20,"relax":false},"relaxation":null,"routes_in":[[0,2,0,85699.0],[0,2,1,20168.0],[0,2,2,134514.0],[0,3,0,110839.0],[0,3,1,31935.5],[0,3,2,190151.0],[0,4,0,90765.0],[0,4,1,25310.0],[0,4,2,141695.0],[0,5,0,58379.0],[0,5,1,16270.0],[0,5,2,85406.0],[0,10,0,109638.0],[0,10,1,32463.5],[0,10,2,161658.0],[1,1,0,137852.0],[1,1,1,44833.0],[1,1,2,211374.0],[1,8,0,54493.0],[1,8,1,14585.0],[1,8,2,93158.0],[2,0,0,258797.0],[2,0,1,63709.0],[2,0,2,384147.0],[2,2,0,4177.0],[2,2,1,3019.0],[2,2,2,24746.0]],"routes_out":[[0,0,124796.0],[0,1,29091.0],[0,2,195028.0],[5,0,48588.0],[5,1,16690.0],[5,2,75677.0],[10,0,33766.0],[10,1,8785.0],[10,2,77163.0],[15,0,36185.0],[15,1,11189.0],[15,2,54421.0],[20,0,23356.0],[20,1,6147.0],[20,2,37233.0],[25,0,24896.0],[25,1,5132.0],[25,2,27422.0],[30,0,19857.0],[30,1,6689.0],[30,2,39984.0],[35,0,18999.0],[35,1,6043.0],[35,2,27873.0],[40,1,1035.5],[41,0,19230.0],[41,1,4414.5],[41,2,35310.0],[45,0,15176.0],[45,1,4064.0],[45,2,22888.0],[50,0,14655.0],[50,1,4429.0],[50,2,24781.0],[55,0,14099.0],[55,1,3387.0],[55,2,24594.0],[61,0,13191.0],[61,1,4051.0],[61,2,24703.0],[68,0,15612.0],[68,1,3379.0],[68,2,21946.0],[72,0,16285.0],[72,1,4215.0],[72,2,18283.0],[78,0,10363.0],[78,1,3180.0],[78,2,17164.0],[80,0,10172.0],[80,1,2970.0],[80,2,17725.0],[87,0,9958.0],[87,1,2756.0],[87,2,14688.0],[90,0,10834.0],[90,1,3363.0],[90,2,15959.0],[96,0,11218.0],[96,1,3044.0],[96,2,16200.0],[101,0,10072.0],[101,1,2393.0],[101,2,14388.0],[105,0,9302.0],[105,1,2439.0],[105,2,15222.0],[110,0,8994.0],[110,1,2701.0],[110,2,14768.0],[115,0,11134.0],[115,1,2602.0],[115,2,12656.0],[121,0,9877.0],[121,1,2149.0],[121,2,15381.0],[125,0,7371.0],[125,1,2278.0],[125,2,13615.0],[130,0,7144.0],[130,1,2091.0],[130,2,13517.0],[136,0,7746.0],[136,1,2486.0],[136,2,13495.0],[141,0,7396.0],[141,1,2156.0],[141,2,14156.0],[145,0,7405.0],[145,1,2552.0],[145,2,12054.0],[153,0,8582.0],[153,1,1985.0],[153,2,13560.0],[156,0,9232.0],[156,1,2119.0],[156,2,9981.0],[161,0,6018.0],[161,1,2287.0],[161,2,9974.0],[165,0,6021.0],[165,1,1945.0],[165,2,10974.0],[172,0,8085.0],[172,1,2017.0],[172,2,10603.0],[176,0,6561.0],[176,1,2137.0],[176,2,8710.0],[180,0,7381.0],[180,1,2233.0],[180,2,10974.0],[186,0,7633.0],[186,1,2003.0],[186,2,7499.0],[191,0,7457.0],[191,1,2208.0],[191,2,9040.0],[195,0,6419.0],[195,1,2466.0],[195,2,10326.0],[201,0,6940.0],[201,1,1823.0],[203,2,9255.0],[206,0,6741.0],[206,1,1718.0],[206,2,9576.0],[210,0,5689.0],[210,1,1537.0],[210,2,9525.0],[215,0,5715.0],[215,1,1842.0],[215,2,7928.0],[220,0,6060.0],[220,1,1540.0],[220,2,9813.0],[227,0,6332.0],[227,1,1543.0],[227,2,9610.0],[231,0,5036.0],[231,1,1487.0],[231,2,7402.0],[235,0,5561.0],[235,1,1703.0],[235,2,8927.0],[241,0,5450.0],[241,1,1411.0],[241,2,8044.0],[245,0,4366.0],[245,1,1523.0],[245,2,8023.0],[251,0,5400.0],[251,1,1563.0],[251,2,8752.0],[255,0,4602.0],[255,1,1354.0],[255,2,7364.0],[260,0,4676.0],[260,1,1294.0],[260,2,7923.0],[266,0,5808.0],[266,1,1080.0],[266,2,8271.0],[271,0,4220.0],[271,1,1364.0],[271,2,6631.0],[275,0,4943.0],[275,1,1209.0],[275,2,6937.0],[280,0,4563.0],[280,1,1516.0],[280,2,7612.0],[285,0,4178.0],[285,1,1312.0],[285,2,7557.0],[290,0,3906.0],[290,1,1264.0],[290,2,6424.0],[295,0,4011.0],[295,1,1273.0],[295,2,5832.0],[300,0,5302.0],[300,1,1120.0],[300,2,7810.0],[307,0,4209.0],[307,1,1333.0],[307,2,6956.0],[310,0,4457.0],[310,1,1272.0],[310,2,7245.0],[316,0,4755.0],[316,1,1381.0],[316,2,7381.0],[321,0,4066.0],[321,1,1628.0],[321,2,7345.0],[325,0,4097.0],[325,1,1060.0],[325,2,5438.0],[331,0,4070.0],[331,1,1153.0],[331,2,6654.0],[336,0,4817.0],[336,1,967.0],[336,2,5635.0],[340,0,3741.0],[340,1,1212.0],[340,2,5442.0],[345,0,4494.0],[345,1,1315.0],[345,2,6982.0],[350,0,4256.0],[350,1,1328.0],[350,2,5970.0],[357,0,4089.0],[357,1,1112.0],[357,2,6153.0],[360,0,3869.0],[360,1,1038.0],[360,2,5897.0],[366,0,4676.0],[366,1,824.0],[366,2,5120.0],[370,0,3786.0],[370,1,1099.0],[370,2,5275.0],[375,0,3928.0],[375,1,1094.0],[375,2,4753.0],[380,0,3848.0],[380,1,1050.0],[380,2,7341.0],[385,0,4281.0],[385,1,1230.0],[385,2,5010.0],[390,0,3754.0],[390,1,956.0],[390,2,7860.0],[395,0,3998.0],[395,1,1384.0],[395,2,5325.0],[400,0,5289.0],[400,1,1080.0],[400,2,5907.0],[405,0,4506.0],[405,1,1065.0],[405,2,4931.0],[410,0,3498.0],[410,1,1008.0],[410,2,5154.0],[417,0,4029.0],[417,1,885.0],[417,2,7952.0],[420,0,3439.0],[420,1,1013.0],[420,2,6816.0],[426,0,3219.0],[426,1,1204.0],[426,2,4575.0],[430,0,3726.0],[430,1,1211.0],[430,2,5970.0],[435,0,2869.0],[435,1,852.0],[435,2,4931.0],[440,0,4186.0],[440,1,867.0],[440,2,5650.0],[446,0,3112.0],[446,1,938.0],[446,2,5819.0],[450,0,3814.0],[450,1,941.0],[450,2,4816.0],[455,0,3343.0],[455,1,1148.0],[455,2,5538.0],[460,0,2902.0],[460,1,821.0],[460,2,5386.0],[469,0,4406.0],[469,1,1026.0],[469,2,6133.0],[471,0,3563.0],[471,1,960.0],[471,2,5336.0],[475,0,3745.0],[475,1,1043.0],[475,2,5164.0],[480,0,2707.0],[480,1,975.0],[480,2,5303.0],[485,0,3260.0],[485,1,894.0],[485,2,5692.0],[490,0,2863.0],[490,1,1131.0],[490,2,4487.0],[496,0,2407.0],[496,1,1018.0],[496,2,4356.0]],"service_level":1.0,"site_use":[{"capacity_units":1004598.0,"site":0,"units":668049.0,"utilization":0.665},{"capacity_units":674428.0,"site":1,"units":378684.0,"utilization":0.5615},{"capacity_units":566681.0,"site":2,"units":254383.2,"utilization":0.4489},{"capacity_units":530877.0,"site":3,"units":314056.6,"utilization":0.5916},{"capacity_units":442488.0,"site":4,"units":244617.0,"utilization":0.5528},{"capacity_units":345891.0,"site":5,"units":152735.8,"utilization":0.4416},{"capacity_units":303742.0,"site":8,"units":152355.4,"utilization":0.5016},{"capacity_units":290906.0,"site":10,"units":290906.0,"utilization":1.0}],"status":"Optimal","total_demand_tons":2589781.0,"unmet_tons":0.0},{"binding":[{"group":"plant_supply","id":"P0/cold","shadow_usd_per_unit":8.32,"slack":0.0,"unit":"ton"},{"group":"plant_supply","id":"P0/ambient","shadow_usd_per_unit":4.992,"slack":0.0,"unit":"ton"},{"group":"plant_supply","id":"P0/bulk","shadow_usd_per_unit":3.744,"slack":0.0,"unit":"ton"}],"components":{"fixed_usd":153740000.0,"handling_usd":33722083.0,"inbound_transport_usd":198027746.78,"outbound_transport_usd":202518872.615,"penalties_usd":{"capacity_overshoot":0.0,"open_sites_excess":0.0,"s